{
  "provider": "claude-code",
  "verdict": "concern",
  "confidence": "low",
  "reality_delta": "无法在源码级验证任何 claim。本轮 Prism 被拒绝文件读取权限，只能基于 review request 文本做推断——而这正是 Prism 被设计要防御的模式：用文档/声明替代实现事实。request 声称三处边界检查已统一到 e2e_active_run_boundary_failures，但无任何源码行可交叉验证。函数命名 via_boundary_check 后缀暗示 wrapper 模式，若底层实现不变，wrapper 只是重命名而非真正统一。self-check 靠函数定义计数防止分裂，但这种计数极易被绕过（重命名旧函数、在 wrapper 内嵌条件分支等）。证据 receipt 路径存在但内容不可见，无法确认探针/干跑是否真的验证了边界统一行为而非仅验证命令可执行。",
  "main_concern": "无法进行源码级审查：Prism 被拒绝文件读取，只能审阅 review request 文本本身。这构成评审闭环断裂——请求方要求「源码级确认」，但评审方拿不到源码。在此约束下任何 verdict 的置信度都无法超过 low。review request 的 claims 结构自洽但无法排除以下可能：统一只是表面 wrapper，底层仍有条件分支；函数计数 self-check 被通过删除旧函数而非合并来满足；探针/干跑 receipt 只证明命令可运行而非行为正确。",
  "top_risks": [
    "wrapper 重命名而非真正统一：via_boundary_check 后缀暗示薄包装，若旧实现只是被移动/重命名而非逻辑合并，边界检查分裂风险未消除",
    "self-check 计数机制可被绕过：若旧函数被重命名为非 boundary 前缀的 helper，计数断言仍通过但旧逻辑仍在运行",
    "探针/干跑无法证明统一性：receipt 只证明 happy-path 通过，不能证明所有边界条件路径收敛到同一函数"
  ],
  "missing_evidence": [
    "源码 diff：complete_revival_e2e.py 中 e2e_active_run_boundary_failures 的完整实现及其所有调用点",
    "旧实现的删除证据：之前手写的 lifecycle_state/completion_boundary 判断代码是否已物理删除（非仅注释或条件跳过）",
    "负向探针结果：探针是否验证了统一后对非法输入的拒绝行为与统一前一致（而非仅验证新的正例）"
  ],
  "minimum_fix": "授予 Prism 对 complete_revival_e2e.py 的源码读取权限，并行验证：(1) e2e_active_run_boundary_failures 在文件中只定义一次；(2) 所有三个调用点（入口/收束/巡检发现）确实传递相同参数集到同一函数；(3) 旧的手写边界判断代码行已物理删除而非条件跳过；(4) 探针 receipt 中至少包含一个非法输入的拒绝记录。满足以上四项后可重新裁定。",
  "anti_loop_signal": {
    "present": true,
    "reason": "第六轮复核已构成循环：每轮 Prism 提出 concern → 下一轮声称已修复 → 但 Prism 始终未被授予源码验证能力 → concern 无法闭合 → 进入下一轮。若本轮仍拒绝文件读取，此循环将无限继续，建议在源码可见条件下做终局裁定后停止迭代。"
  },
  "user_intent_alignment": "aligned"
}
