{
  "provider": "kimi",
  "verdict": "concern",
  "confidence": "high",
  "reality_delta": "超时治理、中文输出自检、信号清理等行为级代码确实已写入，但所有‘验证通过’的证据均来自实施方（Cap）自己编写的自检脚本。没有独立第三方（Norven 或另一 Prism 实例）运行并确认输出的记录。真正的 Revival 压力测试——360 度旧 RedCap 扫描——尚未执行，因此当前‘完成’只是自检报告层面的完成，不是真实负载下的完成。",
  "main_concern": "用自写自检（self-check）替代独立验证，将‘生成证据并通过’等同于‘完成任务’。",
  "top_risks": [
    "自检偏差（Self-check bias）：实现者与测试作者为同一主体，若底层理解有误，错误会被同时编码进实现与测试，导致双双通过。",
    "阶段边界幻觉（Phase-boundary fantasy）：在 360 度扫描前宣告基础设施完结，团队可能已心理上切换上下文，导致扫描暴露问题时修复成本与认知负荷显著上升。",
    "中文策略空心化：human-output checker 声称通过，但本次审查请求本身、所有证据描述及元数据路径均为英文，说明策略在元数据层和审查层尚未真正落地。"
  ],
  "missing_evidence": [
    "独立见证：Norven 或 Prism 亲自运行 `runtime/bin/redcap check`、`runtime/prism/bin/prism check` 及 `prism-dispatch-timeout-e2e`，并书面确认输出与声称一致。",
    "真实提供者压力测试：使用真实的 Kimi/Claude provider 在紧约束的 task-total 超时预算下执行一次端到端 `prism-dispatch`，验证超时拒绝、元数据落盘及子进程清理，而非仅模拟本地子进程。",
    "预扫描集成验证：使用新基础设施加载至少一个旧 RedCap 考古碎片（archaeology shard），证明 infra 能实际支撑下一阶段，而非仅‘理论上可 reopen’。"
  ],
  "minimum_fix": "在关闭批次前，必须满足以下之一：(a) Norven 或独立第三方运行全部检查套件并书面确认输出；(b) 用真实 provider 和紧 task-total 超时做一次端到端 dispatch，证明超时治理在真实链路中生效；(c) 若必须现在标记批次状态，则将其明确设为‘扫描前条件关闭（conditional close）’，在 360-scan 成功完成后才最终归档，而非彻底关闭。",
  "anti_loop_signal": {
    "present": true,
    "reason": "Cap 已将历史 Prism 关切系统性地转化为新的 checker、contract 或 ledger 状态。请停止继续增加检查器。当前需要的不是为本次审查意见再写一个 test，而是在真实负载下证明现有检查器确实约束了系统行为。"
  },
  "user_intent_alignment": "表面对齐：所有已知未完成项均有对应状态、合同和自检。实质上存在漂移：用户要的是‘ Revival 前基础设施真正可用’，而主 AI 交付的是‘基础设施有文档和自检且自检通过’。真正的可用性应由 360 度扫描验证，而不是把扫描失败后再 reopen 当作安全网。"
}
