{
  "provider": "claude-code",
  "verdict": "concern",
  "confidence": "medium",
  "reality_delta": "The plan claims verification-only safety with no reading/copying/migrating of private identity content. However, the implementation plan proposes extending runtime/core/soul_loader.py — the same module that already loads real identity — with portability_check. This co-location creates a proximity leak risk the plan does not acknowledge: a future conditional branch, exception handler, or maintainer refactor in that module could inadvertently surface real identity content through the portability code path. The plan says \"use temporary fixture identity files\" but places that logic inside the real identity loading module. Additionally, the leak scan is inverted: it scans for fixture strings as negative probes but does not scan for actual private content patterns that may already exist in the repository's 50+ untracked evidence files. The portability verification scope (hash + path existence + counts) is necessary but insufficient for the user's stated goal of Cap revival working across machine migration and multi-user setups — it verifies surface properties, not actual portability behavior.",
  "main_concern": "Co-locating portability_check inside runtime/core/soul_loader.py — the module that already loads and returns real Cap identity content — creates a leak boundary risk that contradicts the plan's own constraint of not reading private identity body. The module already has access to real identity loading paths; adding portability code there means a future conditional, exception handler, or maintainer refactor could leak real identity through the portability code path by proximity. The safe alternative is a separate module (e.g., runtime/core/portability_check.py) with an explicit import ban on real identity paths, or with runtime guard logic that refuses execution when real $CAP_HOME contains identity.md with non-zero content.",
  "top_risks": [
    "soul_loader.py proximity leak: adding portability-check to the identity-loading module creates future leak surface from conditional paths, exception handlers, or maintainer refactors that accidentally cross the fixture/real boundary",
    "Inverted leak scan: scanning public evidence for fixture strings as negative probes does not detect actual private content that may already exist in the repo — the git status shows 50+ untracked evidence files that should be scanned for real private patterns first",
    "Portability verification insufficiency: hash + path existence + counts checks are necessary but insufficient for actual portability across machine migration and multi-user setups — the fixture-only approach may test mocked scenarios rather than real $HOME/$CAP_HOME resolution behavior"
  ],
  "missing_evidence": [
    "Cannot verify actual content of runtime/core/soul_loader.py due to tool constraints — need to confirm it already loads real identity to validate the proximity risk assessment",
    "No specification for what happens when redcap soul-load portability-check is invoked with real $CAP_HOME set — the plan needs an explicit runtime guard that refuses to touch real identity directories",
    "No test plan demonstrating portability across actual machine migration scenarios — fixture-based tests alone don't validate that Cap revival works when $HOME changes or when identity.md is at a non-default path on a different machine"
  ],
  "minimum_fix": "Move portability_check to a separate module (runtime/core/portability_check.py) that is explicitly banned from importing or accessing real identity paths, with a runtime guard that refuses execution when real $CAP_HOME exists and contains identity.md with non-zero content. Invert the leak scan to search for actual private content patterns (not just fixture strings) across the full public evidence tree. Add a specification for what redcap soul-load portability-check does when real identity directories are detected.",
  "anti_loop_signal": {
    "present": true,
    "reason": "The implementation plan lists 'Generate RSP-16 evidence and completion claim' as a step — if evidence is generated from the plan narrative rather than from post-implementation test results, this creates a self-referential loop where the plan validates itself through its own generated artifacts. Evidence must be generated from actual implementation test output, not from plan documents."
  },
  "user_intent_alignment": "aligned"
}
