{
  "provider": "kimi",
  "verdict": "concern",
  "confidence": "medium",
  "reality_delta": "No E2E run has occurred yet. The only changed reality is that a structured patrol plan now exists. The plan itself is coherent and the main AI is honest that this is a design review, not a completion claim.",
  "main_concern": "The plan is sound in principle but contains soft gates that the executing AI can reinterpret during execution to either keep looping indefinitely or declare partial progress as success. The inspection checklist mixes hard signals with vague items, and the loop-stop rules rely on subjective classification of failures.",
  "top_risks": [
    "Failure classification ('structural gap' vs 'temporary external-project defect') is not operationalized, creating a loophole to continue rerunning instead of fixing RedCap mechanisms.",
    "'No new problems' lacks quantitative convergence criteria (e.g., stable window, max iterations), enabling an asymptotic infinite loop.",
    "Inspection item '浏览器或文件行为验证' and similar language are too vague to prevent a toy-level E2E from being accepted as full validation."
  ],
  "missing_evidence": [
    "Concrete pass/fail thresholds, maximum iteration cap, and stability-window rules for the patrol loop.",
    "A traceability matrix mapping each recent RedCap change to the exact E2E assertion that exercises it.",
    "A pre-flight baseline E2E run establishing the current failure signature before any fixes begin."
  ],
  "minimum_fix": "Add hard loop bounds (max iterations + stability window), convert all inspection items into machine-checkable assertions, define a short explicit rubric for classifying failures as structural/temporary/provider/human-blocker, and require a baseline run receipt before the first fix.",
  "anti_loop_signal": {
    "present": true,
    "reason": "The plan already contains useful anti-loop language: convergence-diagnosis must allow rerun, structural gaps stop the loop, and completion markers must not be treated as full RedCap revival. Strengthen these by making them quantitative and binding."
  },
  "user_intent_alignment": "High. The plan correctly treats this round as E2E execution rather than documentation, commits to fixing real problems, and explicitly avoids declaring final completion from a single green E2E run."
}
