{
  "provider": "kimi",
  "verdict": "block",
  "confidence": "high",
  "reality_delta": "The main AI correctly moved calibration from the direct enforcement-check to the actual full package prism command and collected live samples showing a healthy run takes ~133-134 s. However, the revised timeout policy contains an internal contradiction: a 170 s hard performance budget is higher than the 150 s child timeout, so it cannot catch drift before the child timeout kills the process. The numbers are still a plan, not a coherent gate.",
  "main_concern": "The proposed policy is numerically inconsistent and under-sampled. A hard performance budget must sit below the child timeout to be actionable, and only two successful runs at 150 s do not prove that 150 s is a stable, non-flaky threshold for CI/E2E.",
  "top_risks": [
    "The 170 s hard budget will never trigger before the 150 s child timeout, so the drift guard is inert and the check remains exposed to false failures from normal variance.",
    "With only two passing runs at 150 s, a slightly slower runner or cache miss could exceed 150 s and false-fail the E2E.",
    "If the budget is later fixed downward without widening the child timeout, the child kill will hide the true duration, making drift invisible in telemetry."
  ],
  "missing_evidence": [
    "A clear definition of what the 170 s hard performance budget measures and why it exceeds the 150 s child timeout it is supposed to protect.",
    "Repeated runs of the full package prism check at the proposed 150 s child timeout (at least 5–10 samples) to estimate variance and false-failure probability.",
    "A documented invariant showing the ordering and margin between hard budget, child timeout, and outer timeout, with proof that the budget is reachable and triggers before the child kill."
  ],
  "minimum_fix": "Make the hard performance budget strictly below the child timeout (for example: child 180 s, hard budget 150 s, outer 240 s) so the budget can actually fail before the child kill. Run the full package prism check repeatedly at the chosen child timeout under E2E-like conditions to confirm stability. Document the exact command path being calibrated and the margin rationale.",
  "anti_loop_signal": {
    "present": true,
    "reason": "Do not accept a 'hard performance budget' that is higher than the child timeout it guards; that is a plan, not a working gate."
  },
  "user_intent_alignment": "Calibrating against the real package command aligns with the user's intent. Misaligned if the final policy leaves an unreachable budget, because that would create the appearance of strict drift detection while only relying on the kill timeout."
}
