{
  "provider": "kimi",
  "verdict": "pass",
  "confidence": "medium",
  "reality_delta": "本轮补齐了上一轮明确缺失的三项证据：validate_contract 对 external_validation_observer 的强制检查源码片段、design-check 执行回执、py_compile 执行回执。同时 validator 输出新增了 runtime_isolation 字段（独立 pid/ppid/executable/argv/cwd/ps 快照），合同也把 runtime_isolation_required 和对应 evidence_required 写入硬准入。这些不是仅更新文档，而是代码路径和运行时检查的真实变更。",
  "main_concern": "证据链仍由同一系统生成，存在理论上的深度自证可能（例如运行器伪造 runtime_isolation 或 design-check 绕过自身检查）。但在当前 narrow scope 内，这种风险已被多层可审计信息（AST 导入检查、独立进程快照、调用记录、源码快照哈希）显著压低。",
  "top_risks": [
    "所有证据仍来自 RedCap 自身运行环境，未引入独立 CI 或第三方审计者；若运行器存在共谋漏洞，仍可伪造整条链。",
    "fixture 使用 --stale-active-hours 0.0001 的极端阈值，虽能验证清理逻辑，但未覆盖更接近真实场景的较长陈旧窗口。",
    "OL-01 实际执行时仍需证明这些准入条款在真实外部项目中被调用和检查，而不仅在本仓库 fixture 中通过。"
  ],
  "missing_evidence": [
    "独立 CI/外部触发器对同一 design-check 和 validator 命令的重跑回执。",
    "OL-01 真实外部项目首次运行时 external_validation_observer 被触发并阻塞/通过的记录。",
    "validator 在 stale-active-hours 更接近默认值（如 1-3 小时）下的行为记录。"
  ],
  "minimum_fix": "无需在当前基础修复阶段追加。建议 OL-01 执行时保留 external_validation_observer 首次触发的原始回执，作为下一阶段棱镜复核的硬证据。",
  "anti_loop_signal": {
    "present": true,
    "reason": "团队连续三轮针对具体 concern 做最小代码/回执修复，范围稳定收窄，未把文档更新当作完成，也未把当前阶段冒充为完整复活。"
  },
  "user_intent_alignment": "良好。本轮主张严格限定为'关闭上一轮 concern'，明确区分基础修复与完整 OL-01 外部 E2E，符合 Norven 对阶段成果不得冒充完整完成的要求。"
}
