{
  "provider": "kimi",
  "verdict": "concern",
  "confidence": "medium",
  "reality_delta": "二轮修复的方向正确且力度加大：knowledge_gateway.py 显式引用 RSP-10/RSP-19 生命周期文件做回归，RSP-08 负向探针新增 'two executed decision paths' 要求，说明反事实执行不再只是字段填充。但 bundle 中证据文件仍在关键处截断， visible 内容里仍未出现 '排除当前任务' 的具体历史样本 ID、modified_at_utc 时间戳，以及 counterfactual.executions 的完整双路径记录；因此无法独立确认循环自证已被打破。",
  "main_concern": "历史样本独立性仍未被完整验证：RSP-07/08 本轮证据可能仍在消费同一批 2026-06-21 的 RSP-05/06/10/19 工件，而这些工件可能是在本次 RSP-07/08 实施过程中被创建或改写的，不能证明 '自我净化/知识召回在普通任务中自然触发'。",
  "top_risks": [
    "同日文件名（20260621-rsp-10/19）不能保证时间早于本轮 RSP-07/08 任务；若这些生命周期包是在本轮实现中补录的，则 '历史样本' 仍是本轮任务的副产品。",
    "development_lifecycle.py 的截断内容未展示 gate/intake/run-loop 调用链，硬阻断可能只在专项检查时生效，正常任务仍可能旁路。",
    "counterfactual.executions 若只是检查脚本对同一输入跑两次并比较字段，而非真实任务在两种知识状态下的分支，则 '反事实' 仍是模拟而非真实决策差异。"
  ],
  "missing_evidence": [
    "历史样本元数据：每个被引用的 lifecycle 样本的 created_at/modified_at_utc、task_id，以及明确标注 'excluded_current_task_id'，证明它们早于本轮 RSP-07/08 且非本轮生成。",
    "一段非 RSP 的 RedCap 任务完整执行日志（或 E2E 测试输出），展示 intake → planning → implementation → completion 流程中，development_lifecycle.py 因缺少知识决策影响而真实失败并阻止推进。",
    "RSP-08 counterfactual.executions 完整内容：without_adopted_knowledge 与 with_adopted_knowledge 两条路径各自产生的具体决策文本/输出差异，而不仅是 changed_decisions 布尔列表。"
  ],
  "minimum_fix": "在关闭 RSP-07/08 前，必须在 review 请求或证据摘要中显式列出：1) 被引用的 RSP-10/RSP-19/RSP-05/06 生命周期样本的 created_at 时间戳，且均早于本轮任务开始时间；2) 至少一个普通任务（非 RSP-07/08 自身）的端到端日志，证明生命周期硬阻断真实生效；3) counterfactual.executions 中两条路径的具体决策差异文本。若以上三点可在当前 bundle 中通过非截断方式展示，则 concerns 可降为成熟度项；否则仍为阻塞项。",
  "anti_loop_signal": {
    "present": true,
    "reason": "主 AI 持续声明 '本轮仍未声明完成'，没有完成口径污染，这是健康的。但 'changed_reality' 从 '新增检查' 一路升级到 '历史样本 + 硬阻断 + 反事实执行'，叙事越来越像已完成；需要警惕用更精美的证据结构替代 '普通任务真实触发' 这一最终事实。"
  },
  "user_intent_alignment": "部分对齐。用户要的是能力进入真实工作流，本轮确实把校验能力写进了生命周期模块、增加了回归和反事实机制，方向正确。但在 '历史样本是否独立' 和 '普通任务是否真实触发' 两个关键点上，visible 证据仍不足，因此尚未充分满足用户意图。"
}
