{
  "provider": "claude-code",
  "verdict": "concern",
  "confidence": "low",
  "reality_delta": "The main AI claims to have added section 2.2.4 mapping each open RSP item to contracts, checks, or code paths — directly addressing my previous minimum fix. This is the correct structural response. However, the key verification file (plan-excerpt-and-hash.md) and the plan itself are unreadable in this context, so I cannot confirm whether the mapping is substantive (specific contract names, check entries, file paths) or nominal (generic categories like \"reuse existing X contract\" without enumerating which items map to which contract). The delta between what is claimed and what is verifiable remains unknown.",
  "main_concern": "The excerpt-and-hash evidence file is a closeout artifact — its existence proves documentation was generated, not that the execution mapping in section 2.2.4 is concrete enough to guide implementation. Without reading the actual mapping, I cannot distinguish between a genuine resolution path (e.g., \"RSP-04 maps to advisory-stop.json contract, verified by check_runner.py:412\") and a nominal mapping (e.g., \"RSP-04 → reuse existing advisory contract\"). The Prism review bias explicitly warns against claims that rely on closeout artifacts instead of implementation facts.",
  "top_risks": [
    "If section 2.2.4 uses reused contracts without auditing whether those contracts actually cover the residual scope, the mapping creates false confidence without real coverage.",
    "The excerpt file as sole verifiable evidence creates a self-referential verification loop — the plan proves the excerpt exists, and the excerpt proves the plan was edited.",
    "The anti-loop mechanism from my previous review remains unaddressed — no structural check prevents this round of plan refresh from being followed by another round of plan refresh."
  ],
  "missing_evidence": [
    "The actual content of section 2.2.4 — the execution mapping itself — is unreadable in this review context, making this review incomplete.",
    "No contract file SHA or content excerpt proves that existing contracts actually cover the claimed residual scope.",
    "No evidence that any contract or check file was cross-referenced (e.g., git show of an existing contract to confirm its scope matches what section 2.2.4 claims)."
  ],
  "minimum_fix": "The excerpt file should include at least one concrete example from section 2.2.4 showing the full mapping for a single open RSP item — including the specific contract filename, the specific check entry, and the specific runtime path — to prove the mapping is actionable rather than categorical. Additionally, add an explicit anti-loop statement: \"No further plan-only edits are authorized without at least one contract being created or one check being implemented.\"",
  "anti_loop_signal": {
    "present": false,
    "reason": "The lifecycle packet retains completion_claim=false, which is a gate-level guard, but the plan content itself still lacks an explicit statement that prevents further documentation-only iterations from being treated as resolution progress."
  },
  "user_intent_alignment": "aligned"
}
