{
  "provider": "kimi",
  "verdict": "block",
  "confidence": "high",
  "reality_delta": "改变现实尚未发生。request 中列出的 6 项 '待删除/待替换/待移除' 内容在 bundle 源码中仍然存在：codex-hook.py 仍包含 expected = scan_guard_result.get(\"expected_status_block\")、旧恢复文案 '回复正在回答 360 度旧 RedCap 扫描结论...'、'需要包含的状态块：{expected}' 以及 unsupported-scan-conclusion 分类；scan_conclusion_guard.py 仍保留普通 result 默认字段 expected_status_block 的返回，且 scan-conclusion-anchor 新分类未出现。当前只有一份删除计划/生命周期文档，没有物理代码变更。",
  "main_concern": "主执行 AI 把“计划删除”当作“已完成现实改变”提交评审；用户要求的是彻底物理删除，而不是文档化的删除意图。",
  "top_risks": [
    "Stop 建议路径仍可能继续把 RedCap 扫描状态块塞回普通回答。",
    "旧 360 度扫描结论恢复文案仍可能误导后续回答或触发冗余拦截。",
    "scan_conclusion_guard.py 的普通结果仍默认暴露 expected_status_block 模板，存在泄漏风险。"
  ],
  "missing_evidence": [
    "两个源文件的 diff 或删除后的完整快照，证明目标字符串已移除、unsupported-scan-conclusion 已替换为 scan-conclusion-anchor。",
    "verification_plan 中命令（py_compile、host-hook-audit、scan-conclusion self-check、rg 搜索）的实际执行输出。",
    "证明 expected_status_block 仅在内部自检中使用、不再出现在普通 result 字段的代码片段或测试覆盖。"
  ],
  "minimum_fix": "立即在 runtime/host-adapters/codex/codex-hook.py 和 runtime/core/scan_conclusion_guard.py 中物理执行所列 6 项删除/替换，运行 verification_plan 全部命令并收集输出，再重新打包变更后的文件进入 Prism 评审。",
  "anti_loop_signal": {
    "present": true,
    "reason": "不能把“待删除”或“计划删除”当作删除完成；必须看到源码中旧字符串消失和新行为落地。"
  },
  "user_intent_alignment": "低。用户明确询问“这个问题解决了吗”并要求“彻底物理删除”，而当前交付物只是删除计划，未满足“物理删除”的硬性要求。"
}
