{
  "confidence": "medium",
  "provider": "claude-code",
  "verdict": "concern",
  "reality_delta": "The refresh adds three concrete artifacts targeting the 'one-time command' concern: validate_cap_input function, two negative fixtures (unlisted-file and extra-content), and a self-check aggregation step in check_runner. These are genuine improvements — they transform cap-load from a passive record into a verifiable input contract. But the approach remains fundamentally command-based (check-then-consume) rather than interceptor-based (every-read-is-gated). The critical gap is whether check_runner enforces cap-input-check as a mandatory prerequisite before Cap processes Prism results, or whether it's an independently-callable command that a different code path can bypass. The rsp-04-readable-excerpts.md file — the primary compact evidence designed for this review — is unreadable, so I cannot verify whether the implementation matches the structural claims.",
  "main_concern": "The cap-input-check is a discrete validation command, not an enforced prerequisite gate. If any code path in Cap's lifecycle reads Prism results without first calling cap-input-check (or if cap-load manifest is regenerated between check and consumption), raw files enter context through an unvalidated door. The check proves the validator works — it doesn't prove every consumption path goes through the validator. The check_runner integration adds the step, but without an ordering contract (cap-input-check MUST execute before any Cap component reads Prism results), the gate exists but the fence has gaps.",
  "top_risks": [
    "Stale manifest bypass: if cap-load is regenerated (new Prism runs produce new raw/brief/review) between the cap-input-check invocation and Cap's actual consumption, Cap processes files against a validated-but-stale manifest — the check says 'input matches manifest' but the manifest no longer represents current state.",
    "Self-check aggregation amplification: adding prism-context-boundary-self-check to check_runner.py's aggregation pipeline means self-check output becomes part of the regular check cycle — if self-check output contains file paths, sizes, or hashes derived from raw files, subsequent aggregation steps read that output, consuming context that references raw data (a second-order leak).",
    "Budget viability still unvalidated: the 8192-byte budget concern from the previous review is unaddressed in the refresh — if the budget is too tight for real Cap operation, the boundary prevents context pollution at the cost of preventing Cap from functioning, violating constraint #2 (不把上下文控制变成信息不足)."
  ],
  "missing_evidence": [
    "rsp-04-readable-excerpts.md is unreadable — this is the primary compact evidence file designed specifically for direct review, and its inaccessibility means the core implementation excerpts, self-check output, and negative fixture results cannot be verified.",
    "No evidence that cap-input-check is called as a mandatory prerequisite before Cap consumes Prism results — the check_runner integration is claimed but the ordering contract (check-before-consume enforcement) is not specified.",
    "The two new negative fixtures (cap-input-unlisted-file, cap-input-extra-content) have receipt files listed but unreadable — cannot verify they test rejection (not just detection), or that the failure mode is 'input rejected' rather than 'violation logged but processing continues'."
  ],
  "minimum_fix": "Before closing RSP-04: (1) Define and enforce the ordering contract — cap-input-check MUST be a hard prerequisite that blocks Cap's Prism-result consumption if it fails, not a parallel check step whose failure is logged but ignored; (2) Add a manifest-version or manifest-hash to cap-load output and require cap-input-check to verify the manifest hasn't changed since validation — closing the stale-manifest window; (3) Verify that self-check aggregation output contains only stat-level metadata (paths, sizes, timestamps) and never embeds or derives content from raw/brief files — a single json.load() on a brief file in the self-check path breaks the stat-only guarantee.",
  "anti_loop_signal": {
    "present": true,
    "reason": "The refresh adds prism-context-boundary-self-check to check_runner's aggregation pipeline. Self-check output now flows into the same aggregation that feeds back into the check cycle. If self-check output includes any data derived from raw files (file hashes, content excerpts in error messages, path lists that include raw file paths), subsequent aggregation steps consume context that references raw data. This creates a second-order loop: raw → self-check output → aggregation → context. The chain is one step removed from direct raw consumption but still introduces raw-adjacent data into Cap's context through the check infrastructure itself."
  },
  "user_intent_alignment": "aligned"
}
