{
  "provider": "claude-code",
  "verdict": "pass",
  "confidence": "medium",
  "reality_delta": "补证请求内嵌了具体行号证据（complete_revival_check.py:252-253、codex-hook.py:87/1406/1819、knowledge_gateway.py:901、development_lifecycle.py:30）和明确的 concern_absorbed 语义边界（4 个否定定义 + 门控行为约束），直接回应了上一轮 concern 的两个根因。但账本文件本身和源码行内容仍未被独立读取验证——评审仍依赖补证请求中的自述摘录而非原始文件。",
  "main_concern": "LS-001 的 critical_ledger_extracts 中 evidence_types 包含 source_path 但没有给出 source_paths 字段，与 LS-002/LS-008 的补证不对称。这不构成 block，但意味着 LS-001 的命令输出级证据是当前唯一可定位的锚点，源码级证据路径补证不完整。如果 LS-001 与 LS-008 的 coordinated_separate_fixes 关系中 LS-001 侧的证据弱于 LS-008，修复阶段可能出现证据不对称导致的执行顺序偏差。",
  "top_risks": [
    "LS-001 缺乏 source_paths 补证：extracts 中 evidence_types 声明了 source_path 类型但未列出具体路径和行号，与 LS-002/LS-008 不一致。修复阶段可能因证据锚点缺失而无法独立处理 LS-001。",
    "concern_absorbed 定义虽已明确但未写入账本文件本身：当前定义仅存在于审查请求的 verification_evidence 中。如果后续阶段只读取账本文件而不读取本次补证请求，concern_absorbed 的语义约束可能丢失。",
    "LS-003 的 4 个 evidence_types 中 3 个为 filesystem_metric，这类证据高度依赖运行时环境和数据留存，在代码审查或离线复现场景下可能无法验证——如果 knowledge-gateway impact-check 的历史窗口确实依赖特定 events 文件，而轮转删除了该文件，filesystem_metric 类证据无法阻止误删。"
  ],
  "missing_evidence": [
    "LS-001 的 source_paths 字段未在补证 extracts 中出现：无法确认其源码级证据路径是否真实存在，仅依赖 command_output 单点锚定。",
    "concern_absorbed 定义未确认是否已回写到账本文件内的 finding 条目中——补证仅提供了审查请求中的定义，账本内可能仍是自由文本。"
  ],
  "minimum_fix": "在修复阶段启动前，补全 LS-001 的 source_paths（与 LS-008 对称列出涉及文件路径和行号），并将 concern_absorbed 的四否定定义写入账本文件中的 LS-001 或全局定义区。这两个补全不改变扫描结论，不需要额外 Prism 轮次，可以在修复阶段首任务执行前作为 pre-flight check 完成。",
  "anti_loop_signal": {
    "present": false,
    "reason": "本次补证有明确的收口意图（只判断补证是否解决上一轮 concern，不提出新扫描方向），concern_absorbed 定义限制了门控行为，coordinated_separate_fixes 明确了解耦语义。如果本次通过，扫描阶段可以合法收口进入修复队列。存在循环风险仅当 minimum_fix 被忽略而直接进入修复导致证据不对称问题在修复阶段复现——这属于修复阶段风险而非本轮扫描阶段循环。"
  },
  "user_intent_alignment": "aligned"
}
