{
  "provider": "claude-code",
  "verdict": "concern",
  "confidence": "high",
  "reality_delta": "主 AI 的阶段结论存在结构性过度乐观：所有正式检查通过 = 机制存在已确认，但机制存在 ≠ 机制有效运行 ≠ 机制形成闭环 ≠ 生产可发布。自净化闭环在候选→晋升环节明确断裂（resolved=true 但 promotions_written=false），知识检索 matches_count=0，E2E 运行器已超万行仍为单文件。completion_scope=single-e2e-run 的限定是正确的，但 ready_for_engineering_use=true 的声明与 scope 限定之间存在张力，可能误导后续 AI 或人类读者将单机单轮验收通过等同为生产就绪。",
  "main_concern": "验证剧院（Verification Theater）风险：所有正式检查通过的背后，是检查器验证了机制存在性而非有效性。self_purification check 通过但无实际晋升产出，knowledge-gateway check 通过但 search 返回 matches_count=0，E2E 运行器 check 通过但代码超万行且职责集中。这构成了一种系统性自我欺骗：检查基础设施自证其存在，但系统并未实际变好。更危险的是，这种通过模式会训练后续 AI 将 '检查通过' 等同于 '任务完成'，形成自我强化的验证幻觉循环。",
  "top_risks": [
    "自净化伪闭环：候选记录→合同检查→resolved=true，但 public_promotions_written=false / private_persona_written=false。系统能发现需要改进什么，但从未实际执行改进。如果自净化是 RedCap 的核心差异化能力，当前状态是骨架而非器官。",
    "E2E 运行器膨胀风险：runtime/core/complete_revival_e2e.py 已超 10056 行，新增功能（Loom session_id、独立观察者、长任务边界探针、负向契约探针）全部堆进同一个文件。每次 E2E 增强都在增加单点复杂度和故障域，这与 '增强工程辅助能力' 的目标背道而驰——好的工程工具应当模块化，而非持续膨胀核心文件。",
    "completion-marker 语义歧义：ready_for_engineering_use=true 与 completion_scope=single-e2e-run 并存，not_claimed 列出了几乎所有生产必需能力（跨机器、人工浏览器、生产流量、永久完整复活）。后续 AI 读取此标记时，有高概率只吸收 true 而忽略 scope 限定，做出超出实际能力的部署决策。"
  ],
  "missing_evidence": [
    "自净化候选的实际内容：2 个候选是什么？是真正需要修复的 bug/改进，还是形式化的占位候选？没有候选内容就无法判断自净化机制是否有实质输入。",
    "E2E 运行器修改的 git diff：需要查看 HEAD~10..HEAD 对 complete_revival_e2e.py 的实际 diff，判断新增代码是独立模块化组件（加分）还是在已有巨型函数中追加分支（减分）。",
    "TRPG 项目代码与 RedCap 基础设施代码的比例：需要区分近期 diff 中有多少行是 TRPG 业务逻辑（场景、角色、剧情），多少行是 RedCap 框架能力（检查器、运行器、契约引擎）。没有这个比例就无法判断主轴。"
  ],
  "minimum_fix": "在宣布生产可发布前，必须完成以下最小修复：(1) 自净化闭环：实现一条从候选→合同检查→自动晋升→写入 public_promotions/private_persona→下次任务可检索的完整路径，并在一轮 E2E 中实际产出至少 1 个 promotion；(2) 知识检索有效性：在 E2E 中注入一条已知知识，验证 knowledge-gateway search 能命中并返回相关内容（当前 matches_count=0 但 check=pass 是不正常的）；(3) completion-marker 语义修正：将 ready_for_engineering_use 改为 ready_for_single_machine_single_e2e_cycle，或在其旁边以同等显眼程度注明 scope 限定。",
  "anti_loop_signal": {
    "present": true,
    "reason": "当前 E2E 验证模式存在结构性自我强化风险：检查器验证检查器自身存在→所有检查通过→写入完成标记→下一轮 AI 读取标记确认通过→继续按同样模式构建更多检查器→检查器再次全部通过。自净化发现 2 个候选但从未晋升、知识检索匹配 0 但 check 通过，这是循环的早期信号。如果下一轮 E2E 仍然只增加验证基础设施而不修复闭环断裂，则已进入验证剧院强化循环。"
  },
  "user_intent_alignment": "aligned"
}
