{
  "provider": "claude-code",
  "verdict": "concern",
  "confidence": "high",
  "reality_delta": "入口 exist 但不等于入口 drive。record 命令接收外部传入的 action_evidence 和 objective_delta，只是追加到 ledger 的记账操作，没有证据表明入口本身触发了一轮真实任务执行。self-check 是自引用证明——cmd_self_check 调用 start_long_task 和 record_long_task_iteration 验证自己存在，这是“检查器存在证明”而非“行为驱动证明”。本轮实现将“未统一接入”从“没有入口”改善为“有入口”，但“未完成就汇报”的边界风险并未根除——record 仍接受手填 evidence 且无自动化验证。",
  "main_concern": "record 命令是记账操作而非行为驱动。cmd_record 接收 --action-evidence（文件路径）和 --objective-delta（字符串）作为外部输入追加到 active_run ledger，但从未实际执行 task_kind 指向的任务逻辑。Claude Code 上轮 concern（“入口存在不等于能驱动行为”）未被正面回应——self-check 中 start→record 的调用链只是让入口自己调用自己，不是让入口驱动实际 task_kind 的业务逻辑。用户意图“问题必须正面根治，不能绕过、降级或只用文档/收据/检查器替代实际能力”未完全满足。",
  "top_risks": [
    "record 接受手填 evidence：攻击者/误操作用户可传入空文件路径或虚构的 objective_delta，ledger 仍记录 iteration_id 和 status，造成“已完成一轮迭代”的假象，但实际零行为发生",
    "self-check 同构陷阱：cmd_self_check 通过调用 start→record 验证自身，下次修改者只需保持 self-check 输出 REDCAP_LONG_TASK_CONTRACT_SELF_CHECK_OK 即可通过审查，实际 start/record 逻辑退化不会被发现",
    "generic_active_run_entry 推导可能为函数名模式匹配：如果 derive_capability_layers 仅检查源码中是否存在 start_long_task/record_long_task_iteration 函数名，则入口文件存在即满足，不证明入口已集成到 RedCap 任务调度循环中"
  ],
  "missing_evidence": [
    "record 命令驱动真实 task_kind 执行至少一轮的端到端证据（非 self-check 内的自调用）——例如对某个实际 task_kind 执行 start→record 后，task_kind 的输出物发生可观测变化",
    "action_evidence 非空验证的具体实现——当前证据只展示了 record 成功时的输出，没有展示传入空 evidence 或空 objective_delta 时是否被拒绝",
    "fast_path 与 enabled 的判定边界测试——没有证据表明边界值（如 risk-level 在 low/medium 临界）的决策正确性"
  ],
  "minimum_fix": "在 cmd_record 中新增最小行为验证：不要求本轮就驱动完整的 task_kind 执行，但必须验证 action_evidence 指向的文件存在且非空（至少 N 字节），objective_delta 与上一轮 iteration 的 objective_delta 不同（禁止原地踏步）。同时新增一个 test：传入空 evidence 文件路径时 record 必须返回 ok=false 并给出可操作的错误信息。",
  "anti_loop_signal": {
    "present": false,
    "reason": "No anti-loop signal provided."
  },
  "user_intent_alignment": "drifting"
}
