{
  "provider": "kimi",
  "verdict": "pass",
  "confidence": "high",
  "reality_delta": "The dispatcher self-check now exercises exactly five timeout retries followed by final success (len(retry_attempts) == 6, five timed_out == True), using rebuild_on_retry=True with a custom retry_command_builder that verifies captured provider handle propagation across all five rebuilds. A separate exhausted-timeout fixture tests write_provider_timeout_raw directly, verifying the raw evidence file is written with all attempts and correct max_retries. The markdown_section regex now matches case/space variants (Reality Delta, Main Concern, User Intent Alignment) and the self-check validates Claude Code markdown extraction with these variants. runtime/prism/README.md and assets/contracts/prism-session-protocol.md explicitly document that the fast self-check uses synthetic subprocess fixtures and does not hang real provider network calls. The enforcement-matrix provider-dispatcher source_paths now points to the current 20260601 session instead of the stale 20260531 scaffold session. The prior 20260531-revival-startup-foundations session.json remains explicitly marked main-decided with the recorded reason that implementation follow-up provider reviews timed out without extractable structured review — this accountability boundary has not been blurred.",
  "main_concern": "The cmd_dispatch catch block that integrates run_provider_command timeout with write_provider_timeout_raw, update_session_handle, and SystemExit JSON reporting is still not exercised end-to-end in the self-check. Both constituent functions are tested independently, but the orchestration layer that ties them together is covered only by code inspection.",
  "top_risks": [
    "A regression in cmd_dispatch's session handle update or SystemExit payload formatting on timeout would not be caught by the self-check, though both are simple pass-through operations.",
    "The verify-evidence probe in the enforcement matrix still uses the 20260531-final-scaffold-review run directory, which is appropriate for testing real provider evidence verification but means the matrix does not exercise verify-evidence against a timeout-then-success raw file.",
    "No real provider has yet been dispatched with the 300-second default, so the constant propagation to actual Kimi or Claude Code subprocess calls remains unexercised in production."
  ],
  "missing_evidence": [
    "An end-to-end test of cmd_dispatch with a stubbed provider command that raises ProviderTimeoutError, verifying the full catch block including session handle update and SystemExit JSON.",
    "Evidence that verify-evidence correctly accepts a raw file containing mixed timeout-then-success attempts (exit_code == 0 with prior timed_out entries).",
    "A real provider dispatch completion under the 300-second default, even for a trivial request."
  ],
  "minimum_fix": "No fix is required before marking this correction complete. The remaining gaps are minor integration coverage and production deployment verification, both explicitly bounded by the documented synthetic-fixture limitation. If desired, add a lightweight comment in runtime/prism/bin/prism-dispatch near cmd_dispatch's except ProviderTimeoutError block noting that the orchestration is covered by component tests in --self-check.",
  "anti_loop_signal": {
    "present": true,
    "reason": "The main AI accepted specific Prism concerns and made concrete executable changes rather than documentation-only responses. The self-check grew from validating 1 retry to validating 5 retries, handle propagation, exhausted-timeout raw evidence, and markdown variant extraction. This is genuine repair, not receipt inflation. The risk of loop is low because the task scope was narrow (timeout/retry repair and accountability boundary) and the main AI did not expand it into broader revival architecture work."
  },
  "user_intent_alignment": "aligned"
}
