{
  "provider": "kimi",
  "verdict": "concern",
  "confidence": "medium",
  "reality_delta": "The visible source-pack snippet confirms a new `carrier_probe_final_decision` function exists and that `ok = decision['ok'] and marker_cleanup_error is None`. That is a real code-level change. However, the bundle truncates the rest of the source-pack and the call site that actually wires this decision into the carrier probe, so we cannot independently confirm the production path uses it.",
  "main_concern": "The review is being asked to accept a source-pack document and self-reported command summaries as proof that the production cleanup path is instrumented and that the final decision is used. The authorized bundle does not contain the non-truncated injection site, final-decision call site, or raw command outputs, so the central anti-bypass claim is unverified.",
  "top_risks": [
    "The cleanup-failure injection may live in test scaffolding rather than inside the production `carrier_probe`/`cleanup_marker` path, so real production cleanup errors could still be ignored.",
    "The carrier probe's final summary may still override `ok` or call `carrier_probe_attempt_decision` directly, making `marker_cleanup_error` a dead field.",
    "The `self-check` addition may assert the desired failure mode without exercising the actual production cleanup-injection wiring."
  ],
  "missing_evidence": [
    "Complete, non-truncated source-pack sections for the final-decision call site, the `cleanup_marker` injection code, and the `cleanup_failed_decision` self-check case.",
    "Raw stdout/stderr/exit-code logs from the normal carrier-probe run and the `REDCAP_TEST_INJECT_CARRIER_MARKER_CLEANUP_FAILURE=1` run, not summarized results.",
    "A line-number mapping or diff proving the source-pack snippets match the current committed `runtime/core/complete_revival_e2e.py` (the bundle only includes the first 200 KB of a 454 KB file)."
  ],
  "minimum_fix": "Re-bundle the review with the full, bounded-readable source segments that show (1) where `carrier_probe_final_decision` is called in the carrier probe final summary, (2) the exact `cleanup_marker` code that honors `REDCAP_TEST_INJECT_CARRIER_MARKER_CLEANUP_FAILURE`, and (3) the `cleanup_failed_decision` self-check. Attach the raw command output files. Then re-submit for Prism review before running the full E2E.",
  "anti_loop_signal": {
    "present": true,
    "reason": "Round-over-round the concern has been 'marker_cleanup_error must affect ok'. The visible decision function now does that, but the repeated answer of 'source-pack synchronized' cannot substitute for showing the production wiring and injection path. Watch for the loop where a documentation update is treated as the fix itself."
  },
  "user_intent_alignment": "Partial. The user wants the carrier probe to be actually reliable and not bypassed by form products. The decision-function change is concrete, but without verifiable proof that the production path uses it and that cleanup failures are truly injected in production code, we cannot yet say the user's intended reality has changed."
}
