{
  "provider": "kimi",
  "verdict": "concern",
  "confidence": "medium",
  "reality_delta": "Real code changes were made to hook mode handling, intent classification, raw-read segmentation, and output policy. However, the evidence consists entirely of self-referential command passes with no external validation that real-world false positives disappeared or that enforcement still triggers correctly on actual idle attempts.",
  "main_concern": "The main AI treated 'reduce false positives' as 'make the guards more permissive' rather than 'make detection more accurate,' which silently trades anti-idle enforcement for convenience.",
  "top_risks": [
    "Stop Hook mode override via file is a persistent disable switch; if the file is left in place, enforcement is silently off.",
    "Relaxed output policy uses subjective 'common project terms' that can expand arbitrarily; machine-like English output may pass by claiming project relevance.",
    "Raw-read segmentation logic is unproven against adversarial or oddly wrapped multiline shell commands."
  ],
  "missing_evidence": [
    "Integration tests using historical false-positive prompts to prove they no longer misfire.",
    "Proof that enforcement still triggers on genuine idle/status-confirmation attempts after the relaxations.",
    "Audit log or trace showing Prism visibility was actually restored in live operation, not just in self-checks."
  ],
  "minimum_fix": "Replace the persistent file override with an ephemeral, session-scoped flag; replace the subjective term list with an explicit allow-list of Chinese terms and documented exceptions; run the hooks against a corpus of real past interactions to measure false-positive and false-negative rates.",
  "anti_loop_signal": {
    "present": true,
    "reason": "The next iteration must not add broader exceptions, more override files, or fuzzier language to the guards. If false positives remain, the fix must be stricter pattern definitions or richer context in the classifier, not additional bypasses."
  },
  "user_intent_alignment": "partial — the user explicitly authorized bypassing false positives to fix misfires, but only while preserving anti-idle enforcement. The patch fixes misfires by widening gates, which risks degrading enforcement. It does not demonstrate that enforcement was preserved."
}
