{
  "verdict": "concern",
  "confidence": "medium",
  "provider": "kimi",
  "reality_delta": "No external sandbox has been created, no harness exists, and no objective evidence has been produced. The only change is a proposed design summary that describes future intent. Cap may treat this summary as evidence of forward progress, but the user's actual state—needing a binding acceptance contract—has not advanced beyond the planning stage.",
  "main_concern": "The design summary is directionally correct but structurally permissive: it describes a future harness without binding itself to the 15 archaeology items, without specifying how the test task is chosen to force hard-path coverage, and without defining raw human-inspectable artifacts that prevent Cap from grading its own homework. This creates a high risk that the final design becomes a convincing document that substitutes for actual workflow validation.",
  "top_risks": [
    "Archaeology gap: The 15 portable old RedCap designs and risk/no-promote items are cited as required coverage, yet the proposed design summary does not map them to specific harness criteria, leaving the door open for a narrow happy-path acceptance.",
    "Self-grading loophole: The design lists 'Prism review and Cap resolution' and 'test command results' as objective evidence, but does not specify how those results are rendered independent of Cap's interpretation (e.g., raw JSON logs, immutable artifacts), allowing Cap to effectively test itself.",
    "Design-as-completion drift: The summary language ('should create', 'should state') is aspirational. Without binding constraints (exact harness commands, exact exit codes, exact negative probes), Cap may later claim the design itself satisfies the main claim."
  ],
  "missing_evidence": [
    "A concrete mapping from each of the 15 archaeology items to a specific harness acceptance criterion or negative probe.",
    "Task-selection constraints that prove the sandbox task will realistically exercise the blocked phase, change intake, and Prism rejection paths—not just happy-path implementation.",
    "Evidence that the design contract defines immutable, human-readable artifacts (e.g., raw shell logs, Prism review JSONs, filesystem manifests) whose meaning does not require Cap's narration to verify."
  ],
  "minimum_fix": "Add an explicit 'Coverage Matrix' section to the design that maps every archaeology item to a harness test case or negative probe. Replace aspirational 'should' language with mandatory 'shall' criteria: exact commands, exact expected filesystem states, exact exit codes, and a rule that Cap may not interpret its own test results for terminal acceptance. Specify that the sandbox task must be selected by criteria that guarantee blocked-state and change-intake exercise, not by Cap's discretion.",
  "anti_loop_signal": {
    "present": true,
    "reason": "If Cap later reports 'the acceptance design is complete' as evidence that complete-revival acceptance is satisfied, that is the loop. The design must contain an explicit clause stating: 'Completion of this design document does not constitute completion of RedCap revival; only successful execution of this harness with all objective artifacts produced and inspected shall advance acceptance.'"
  },
  "user_intent_alignment": "Partial. The user wants a binding design contract for future acceptance, and the summary correctly places Norven as the authority for terminal acceptance and policy overrides. However, the user also asked whether an external sandbox run is merely Cap testing itself; the proposed design does not yet answer that question with mechanical safeguards, only with role assignments. Until the design specifies how Cap is structurally prevented from interpreting its own evidence, the user's deeper concern about self-deception is not fully addressed."
}
